{"hash":"3645e902fd54c1da587ccf44d52f52536cd3e29469d3ef456c11053decb7201f","manifest_hash":"58a0e8f6cfa0d355ac09b0ce135d6e16afea22f2a981b45719eb67dfb6dfe9b0","preparation":{"document":{"document_id":"reachability","granularity":"explicit","revision":"sha256:65593eac22a07439d74b3265092f0b6bc68a1ea3d15ce832d771ef463248be26","source_text":"We want to find every vertex reachable from a chosen start vertex by following directed edges.\n\nKeep a collection called pending of vertices waiting to be explored. Initially it contains the start vertex.\n\nWe also keep a set called seen, initially containing the start vertex.\n\nWhen we explore a vertex, inspect each of its outgoing neighbors and consider whether to schedule that neighbor.\n\nSchedule a neighbor only if it is absent from seen, and add it to seen immediately when scheduling it. Thus no vertex is scheduled twice, even when the graph has a cycle.","units":[{"end":94,"kind":"prose","position":"L1","start":0,"text":"We want to find every vertex reachable from a chosen start vertex by following directed edges.","unit_id":"unit-000001"},{"end":204,"kind":"prose","position":"L2","start":96,"text":"Keep a collection called pending of vertices waiting to be explored. Initially it contains the start vertex.","unit_id":"unit-000002"},{"end":276,"kind":"prose","position":"L3","start":206,"text":"We also keep a set called seen, initially containing the start vertex.","unit_id":"unit-000003"},{"end":390,"kind":"prose","position":"L4","start":278,"text":"When we explore a vertex, inspect each of its outgoing neighbors and consider whether to schedule that neighbor.","unit_id":"unit-000004"},{"end":562,"kind":"prose","position":"L5","start":392,"text":"Schedule a neighbor only if it is absent from seen, and add it to seen immediately when scheduling it. Thus no vertex is scheduled twice, even when the graph has a cycle.","unit_id":"unit-000005"}]},"document_digest":"0be9fe8899ab5e1d97119852c1a33826f6d25712a758bc517ee26276e4c8965b","provenance":{"body_start":0,"frontmatter_excluded":false,"input_bytes_sha256":"65593eac22a07439d74b3265092f0b6bc68a1ea3d15ce832d771ef463248be26","input_format":"markdown","normalized_sha256":"65593eac22a07439d74b3265092f0b6bc68a1ea3d15ce832d771ef463248be26","normalizer_schema":"readersim.normalized-document.v0.2","offset_unit":"unicode_code_point","original_source_name":"document.md","original_source_sha256":"65593eac22a07439d74b3265092f0b6bc68a1ea3d15ce832d771ef463248be26","projection_policy":"readersim-block-v1","source_map":[{"legacy_kind":"paragraph","legacy_parent":"L1","normalized_end":94,"normalized_start":0,"position":"L1","unit_id":"unit-000001"},{"legacy_kind":"paragraph","legacy_parent":"L2","normalized_end":204,"normalized_start":96,"position":"L2","unit_id":"unit-000002"},{"legacy_kind":"paragraph","legacy_parent":"L3","normalized_end":276,"normalized_start":206,"position":"L3","unit_id":"unit-000003"},{"legacy_kind":"paragraph","legacy_parent":"L4","normalized_end":390,"normalized_start":278,"position":"L4","unit_id":"unit-000004"},{"legacy_kind":"paragraph","legacy_parent":"L5","normalized_end":562,"normalized_start":392,"position":"L5","unit_id":"unit-000005"}],"warnings":[]},"schema_version":"reader-state.preparation.v1"},"preparation_id":"prep-7c415967cd5552789cbfc9c9431afb8400d2b04c99511046c39ef150880e296b","run_id":"run-ac65209c3cdb421997c8cc76d3e91028","schema_version":"reader-state.preparation-binding.v1"}
